[
  {
    "id": "doctors_vol1_comp_introduction_scope",
    "programId": "program_pgcert_clinical_trichology_hair_restoration_medicine",
    "levelId": "level_doctors_postgraduate_certificate",
    "slug": "volume-1-introduction-physician-led-trichology",
    "title": "Physician-led trichology: scope, evidence tiers, and ethics",
    "domain": "ethical-practice",
    "description": "Define physician-led clinical trichology versus non-medical hair practice; relate trichology to dermatology and transplantation; apply academy evidence tiers (including regenerative and investigational domains); and uphold consent, scope, and medico-legal boundaries as set out in Volume 1 — Foundations of Clinical Trichology.",
    "sequence": 1,
    "requiredForAward": true,
    "evidenceRequirements": [
      {
        "id": "ev_vol1_m1_assessment",
        "description": "Pass the Module 1 knowledge check integrating scope, evidence framing, and ethical boundaries (case discussion faculty-moderated where academy workflow requires)",
        "evidenceType": "assessment",
        "requiredCount": 1
      }
    ],
    "mustBeFacultyVerified": false
  },
  {
    "id": "doctors_vol1_comp_follicle_biology",
    "programId": "program_pgcert_clinical_trichology_hair_restoration_medicine",
    "levelId": "level_doctors_postgraduate_certificate",
    "slug": "volume-1-follicle-biology-scalp-science",
    "title": "Follicle biology, cycling, and scalp environment",
    "domain": "clinical-literacy",
    "description": "Explain follicular anatomy, stem-cell niches, hair cycling (including kenogen/exogen), shaft architecture, scalp microenvironment, ethnic variation, and aging-related change as clinical foundations for diagnosis, counselling, and procedural planning per Volume 1.",
    "sequence": 2,
    "requiredForAward": true,
    "evidenceRequirements": [
      {
        "id": "ev_vol1_m2_assessment",
        "description": "Pass the Module 2 assessment including image-interpretation and case-reasoning items aligned with biology and cycle concepts",
        "evidenceType": "assessment",
        "requiredCount": 1
      }
    ],
    "mustBeFacultyVerified": false
  },
  {
    "id": "doctors_vol1_comp_molecular_hormonal",
    "programId": "program_pgcert_clinical_trichology_hair_restoration_medicine",
    "levelId": "level_doctors_postgraduate_certificate",
    "slug": "volume-1-molecular-hormonal-regulation",
    "title": "Molecular and hormonal drivers of hair loss and therapy logic",
    "domain": "clinical-literacy",
    "description": "Integrate androgen biology, Wnt and prostaglandin signalling, growth mediators, microinflammation, and sex-specific endocrine contributors into a reasoning framework for AGA, female pattern loss, and adjunctive or regenerative options without overclaiming, per Volume 1.",
    "sequence": 3,
    "requiredForAward": true,
    "evidenceRequirements": [
      {
        "id": "ev_vol1_m3_assessment",
        "description": "Pass the Module 3 knowledge check on molecular, hormonal, and treatment-sequence logic",
        "evidenceType": "assessment",
        "requiredCount": 1
      }
    ],
    "mustBeFacultyVerified": false
  },
  {
    "id": "doctors_vol1_comp_consultation_history",
    "programId": "program_pgcert_clinical_trichology_hair_restoration_medicine",
    "levelId": "level_doctors_postgraduate_certificate",
    "slug": "volume-1-structured-consultation-history",
    "title": "Structured hair loss consultation and history-taking",
    "domain": "consultation-structure",
    "description": "Conduct a hypothesis-driven consultation: classify complaint type (shedding, density loss, breakage, patchy/scarring); map onset, tempo, and pattern; obtain mandatory female endocrine and reproductive history; identify drug, nutritional, and trigger factors; document psychosocial burden and uncertainty clearly for longitudinal care and governance, per Volume 1.",
    "sequence": 4,
    "requiredForAward": true,
    "evidenceRequirements": [
      {
        "id": "ev_vol1_m4_assessment",
        "description": "Pass the Module 4 assessment including case-reasoning on history-based differentials, red flags, and documentation (faculty review on free-text items where configured)",
        "evidenceType": "assessment",
        "requiredCount": 1
      }
    ],
    "mustBeFacultyVerified": false
  },
  {
    "id": "doctors_vol2_comp_clinical_examination",
    "programId": "program_pgcert_clinical_trichology_hair_restoration_medicine",
    "levelId": "level_doctors_postgraduate_certificate",
    "slug": "volume-2-clinical-examination-hair-scalp",
    "title": "Clinical examination of hair and scalp",
    "domain": "clinical-literacy",
    "description": "Perform a reproducible examination: global pattern recognition, density versus calibre, scalp inflammatory and scarring clues, pull test and shed versus breakage logic, and standardised photography and grading aligned to Volume 2 — Diagnostic Trichology and Pattern Hair Loss Medicine.",
    "sequence": 5,
    "requiredForAward": true,
    "evidenceRequirements": [
      {
        "id": "ev_vol2_m5_assessment",
        "description": "Pass the Module 5 knowledge check on examination, photography, and red-flag reasoning",
        "evidenceType": "assessment",
        "requiredCount": 1
      }
    ],
    "mustBeFacultyVerified": false
  },
  {
    "id": "doctors_vol2_comp_trichoscopy",
    "programId": "program_pgcert_clinical_trichology_hair_restoration_medicine",
    "levelId": "level_doctors_postgraduate_certificate",
    "slug": "volume-2-trichoscopy-interpretation",
    "title": "Trichoscopy: technique, patterns, and biopsy targeting",
    "domain": "clinical-literacy",
    "description": "Use dry and wet trichoscopy with comparator logic; recognise pattern hair loss features, shedding and immune-mediated patterns, and scarring clues; report findings clearly; and select informative biopsy margins when histology is indicated, per Volume 2.",
    "sequence": 6,
    "requiredForAward": true,
    "evidenceRequirements": [
      {
        "id": "ev_vol2_m6_assessment",
        "description": "Pass the Module 6 trichoscopy knowledge check",
        "evidenceType": "assessment",
        "requiredCount": 1
      }
    ],
    "mustBeFacultyVerified": false
  },
  {
    "id": "doctors_vol2_comp_investigations_biopsy",
    "programId": "program_pgcert_clinical_trichology_hair_restoration_medicine",
    "levelId": "level_doctors_postgraduate_certificate",
    "slug": "volume-2-investigations-biopsy-logic",
    "title": "Laboratory investigations and biopsy logic",
    "domain": "clinical-literacy",
    "description": "Apply phenotype-led investigation; interpret core laboratories in context; target endocrine workup when clinically indicated; decide when biopsy is required; select site and communicate effectively with pathology; integrate histology with trichoscopy and history, per Volume 2.",
    "sequence": 7,
    "requiredForAward": true,
    "evidenceRequirements": [
      {
        "id": "ev_vol2_m7_assessment",
        "description": "Pass the Module 7 investigations and biopsy case-reasoning assessment",
        "evidenceType": "assessment",
        "requiredCount": 1
      }
    ],
    "mustBeFacultyVerified": false
  },
  {
    "id": "doctors_vol2_comp_male_aga",
    "programId": "program_pgcert_clinical_trichology_hair_restoration_medicine",
    "levelId": "level_doctors_postgraduate_certificate",
    "slug": "volume-2-male-androgenetic-alopecia",
    "title": "Male androgenetic alopecia: medical ladder and surgical planning",
    "domain": "clinical-literacy",
    "description": "Diagnose and stage male AGA; recognise overlap disorders; construct evidence-based medical and adjunctive plans with honest stabilisation versus regrowth framing; assess surgical candidacy, donor risk, and long-term hairline realism, per Volume 2.",
    "sequence": 8,
    "requiredForAward": true,
    "evidenceRequirements": [
      {
        "id": "ev_vol2_m8_assessment",
        "description": "Pass the Module 8 male AGA knowledge check",
        "evidenceType": "assessment",
        "requiredCount": 1
      }
    ],
    "mustBeFacultyVerified": false
  },
  {
    "id": "doctors_vol2_comp_female_pattern",
    "programId": "program_pgcert_clinical_trichology_hair_restoration_medicine",
    "levelId": "level_doctors_postgraduate_certificate",
    "slug": "volume-2-female-pattern-hormonal-hair-loss",
    "title": "Female pattern and hormonal hair loss",
    "domain": "clinical-literacy",
    "description": "Recognise FPHL phenotypes and overlap with shedding and endocrine disease; investigate proportionately; build reproductive-safe treatment strategies; position adjunctive and surgical options cautiously; and communicate for chronic longitudinal care, per Volume 2.",
    "sequence": 9,
    "requiredForAward": true,
    "evidenceRequirements": [
      {
        "id": "ev_vol2_m9_assessment",
        "description": "Pass the Module 9 female pattern hair loss knowledge check",
        "evidenceType": "assessment",
        "requiredCount": 1
      }
    ],
    "mustBeFacultyVerified": false
  }
]
